Title,Score,URL,Number of Comments,Created UTC,Body
How to get computer engineering,0,https://www.reddit.com/r/aggies/comments/1fow5a1/how_to_get_computer_engineering/,15,1727238285.0,"i am currently taking ENGR 102, CHEM 107, CHEM 117, MATH 308, MATH 311, NVSC 101, and SOMS 111 and was in the corps but punched and in other engineering clubs and was wondering if this would be a bad schedule next semester? currently, i find the academics part to be very manageable besides for 311 since that class is just confusing as hell and i was wondering what classes should i try my best to get As in cause I know that they consider what classes you get As in order to get ur selected given m"
Anyone have experience with Computer Engineering and the Corps?,0,https://www.reddit.com/r/aggies/comments/1fkt48u/anyone_have_experience_with_computer_engineering/,5,1726774111.0,"Howdy all, I'm a pisshead in the Corps and I recently E-TAMed into Computer Engineering. Last semester, I challenged myself by making an A in Cal 2 and CSCE 120, with Cal 2 being the hardest class I had ever taken. At first, my classes this semester weren't as hard as they were last semester, but recently things have been picking up. Especially in ECEN 248 and PHYS 207.

Now I'm wishing I could go back to Cal 2, back when it was 'easy'. It took me 4 lab sessions to finish the 2nd ECEN 248 lab, a"
Any benefits to E-TAM?,8,https://www.reddit.com/r/aggies/comments/1fibsya/any_benefits_to_etam/,18,1726510753.0,"E-TAM actually benefited me. I came into A&M wanting to major in Comp Sci, but then one of my friends told me about Computer Engineering, which is the major he wanted. That made me put Comp E as my 2nd choice on DI Saturday signups, which I ended up getting. After DI Saturday, I realized that Comp E was more interesting than Comp Sci, and after doing some research, I decided to list Comp E for E-TAM.

I ended up getting into CPEN holistically, and now Physics 207 and ECEN 248 are my favorite cla"
"Tough ecen schedule this semester, thoughts?",5,https://www.reddit.com/r/aggies/comments/1f0dz33/tough_ecen_schedule_this_semester_thoughts/,6,1724529101.0,"I'm taking ecen 248 with weiping shi, 214 with Balog, math 311 with vorobets yaroslav, csce 120 with Zbigniew Leyk and engr 217 with Ijaz. 3 of these profs have 1 star ratings on rmp and my 120 prof has 0 reviews. Im pretty worried with the amount of work this semester will bring considering I have 3 3 hour labs and the lengthy 120 hw. I really don't want to drop anything but as I am thinking about the workload more it seems like that may be what I need to do. Anyone have tips on how to survive "
Do labs start the first week of school?,2,https://www.reddit.com/r/aggies/comments/1esnjdf/do_labs_start_the_first_week_of_school/,11,1723700660.0,Do labs start not start until the second week of school? More specifically the lab for CSCE 120 and CHEM117
CSCE 120 Force Request Question,1,https://www.reddit.com/r/aggies/comments/1eqw547/csce_120_force_request_question/,4,1723514604.0,"I submitted a force request for CSCE 120 (CPEN major) on August 5th (the day they opened), saying that I'd be okay with taking half of the sections (the other half conflict with my current schedule). How do you know when they've looked at your request? If they don't accept it do you get any kind of confirmation? At what point do they start reviewing them and when do they stop? I'm currently only registered for 11 credits and I'd like to take more this semester in case I don't get in to CSCE 120 "
Force Request CSCE 120,3,https://www.reddit.com/r/aggies/comments/1eniwrt/force_request_csce_120/,2,1723155096.0,"I wasn't able to register for a CSCE 120 class and need to submit a force request. I’m wondering if it’s possible to request a section that starts immediately after my lab ends at 3, or if the request will be denied due to the overlapping times. I usually finish my labs well before the official end time, so I’m sure I can make it to the CSCE class on time."
Class questions,2,https://www.reddit.com/r/aggies/comments/1ene4y0/class_questions/,12,1723143338.0,"Howdy, I’m a sophomore majoring in Electrical engineering. I couldn’t get into a CSCE 120 or Engineering 217, so I was advised to take a core curriculum (FILM 299, which is online) and math 308, differential equations. I was just wondering if these classes along with math 251 , Phys 207 (Tatiana) and ECEN 248 was a doable amount of coursework, and if anyone else had been in the same situation as me. I’m also working a part time job while taking these.
Thanks and gig em !

"
 should push  csce 120 a semester. elen major,3,https://www.reddit.com/r/aggies/comments/1emoowp/should_push_csce_120_a_semester_elen_major/,2,1723067985.0,i am trying to take ecen 214 a semester earlier but i can only fit it when i take out my csce 120 class should i do this or am i going to need csce knowledge to do good? 
How much work should I expect from these classes?,7,https://www.reddit.com/r/aggies/comments/1em4bhr/how_much_work_should_i_expect_from_these_classes/,24,1723010417.0,"Howdy! I am a sophomore majoring in Computer Science. This semester I am enrolled for MATH-304, CSCE-120, CSCE-111, CSCE-181, ENGL-210 and STAT 211. I was wondering how much of a workload I should expect from these classes. Any tips on time management would be really helpful.

Thanks in advance!!"
Professor Tier List,9,https://www.reddit.com/r/aggies/comments/1e3njd7/professor_tier_list/,2,1721023524.0,"In the case that someone might find this helpful, here's a tier list of the quality of the professors I took my first year at A&M - College Station, Engineering and the corresponding classes. Writeup below.

https://preview.redd.it/1mag3mftemcd1.png?width=494&format=png&auto=webp&s=ccf39409eeed6c2e2b33bdfc6044f64573366f90

J. Holt for PHYS 206 and 207 - Fantastic, easy-to-understand lectures and reasonable exams. Do several practice exams and utilize his reviews until you feel comfortable with t"
Help with registration,0,https://www.reddit.com/r/aggies/comments/1dqqscx/help_with_registration/,3,1719599698.0,"I'm a rising sophomore majoring in Computer Engineering and the next registration time starts tomorrow. Because of circumstances I missed the times that were available previously. On the program requirements page (https://catalog.tamu.edu/undergraduate/engineering/computer-science/computer-engineering-bs/#programrequirementstext), for fall of sophomore year it says to take CSCE 120, PHYS 207, MATH 251 (I'm ahead so I'm taking 308 instead), ECEN 248 and ENGR 217. My problem is that 217 has basica"
How hard is graduating with a 3.7 in Computer Engineering?,23,https://www.reddit.com/r/aggies/comments/1dehbns/how_hard_is_graduating_with_a_37_in_computer/,17,1718225758.0,"I submitted my E-TAM app for Computer Engineering, and I'm hoping to get into that. Honestly, the upper level ECEN classes seem pretty brutal, especially for the electives I want to take (I want to specialize in computer architecture and signals). I'm also in the Corps of Cadets, which also takes a lot of time. I'm picking up minors in Math and Leadership.

I'm also in a Co-Op program that's supposed to turn into a job once I graduate. The requirement to stay in is a 3.0, but if I graduate with "
How likely am I to get into CPEN with a 3.69?,1,https://www.reddit.com/r/aggies/comments/1d90jxj/how_likely_am_i_to_get_into_cpen_with_a_369/,5,1717620740.0,"I sent in my E-TAM app a few months ago. I have an A in ENGR 102 and CSCE 120. My GPA this semester is a 3.89. I also want to do CPEN because I’m genuinely interested in the hardware side, and I made sure that my essays reflect that. I’m also in the Corps of Cadets, and have a 3-letter agency CS internship for this summer (which is on my essay). 

Am I likely to get in to CPEN? I know that CPEN is WAY more competitive this year due to 25x25…"
Are there summer course fees?,0,https://www.reddit.com/r/aggies/comments/1cy67eo/are_there_summer_course_fees/,11,1716399422.0,"Hey yall I was thinking of registering for CSCE 120 over the summer and saw that the course has a $1000 fee for distance learning. Does this mean my tuition will only be $1000 or will there be additional fees? When I asked some friends they said there would be an additional summer term fee of $1600 but I thought I'd ask here just to make sure that they're right. I've been on the line with Aggie One Stop for an hour now and got no response.

EDIT: Yes the $1000 distance fee is added on top of “su"
How likely am I to get into Computer Engineering with a 3.69 cumulative?,5,https://www.reddit.com/r/aggies/comments/1crbm53/how_likely_am_i_to_get_into_computer_engineering/,9,1715637277.0,"I would have made a 3.75 if it wasn’t for physics lab :( (that was my only B this semester)

Anyway, I made an A in ENGR 102, CSCE 120, Math 152, and Physics 206. I had a 3.5 last semester, and got a 3.88 this semester. Also, I’m in the Corps of Cadets. Should I be able to get into Computer Engineering?
"
How bad is the CSCE120 final?,3,https://www.reddit.com/r/aggies/comments/1c7n49k/how_bad_is_the_csce120_final/,4,1713497903.0,"I got a 100 on the first CSCE 120 exam, but I got a 77 on the second exam. As long as I don't screw up the last homework, I'll just need a 52 on the final to get an A in the class. If I do all of the Redemption assignments (which I plan on doing to study), I'll need a 47 instead of a 52. 

Do I need to study that much for the final to make a 52? Right now, I understand everything except for linked lists xD"
Best Computer Engineering alternatives?,3,https://www.reddit.com/r/aggies/comments/1bjin7y/best_computer_engineering_alternatives/,6,1710954603.0,"Edit: This is based on worst case scenario, as in I don't E-TAM into CPEN or CS Galveston

I want to go into Computer Engineering for A&M, but I'm a little worried about the E-TAM cycle. Right now, I have a 3.665 cumulative GPA, with my only B being Phys 206. If I can pull that to an 'A' (and keep all As), I'll get the 3.75. I got an 'A' in ENGR 102, and have a near 100 in CSCE 120. However, after last night's Calc 152 exam, I'm not feeling too good about keeping an A in Calc 152. Please do not "
Is a 3.5 GPA good for getting into Computer Engineering?,6,https://www.reddit.com/r/aggies/comments/1ahiw2q/is_a_35_gpa_good_for_getting_into_computer/,6,1706920021.0,"I'm a 2nd semester fish in General Engineering, and I want to E-TAM into CPEN with CS track. I have a 3.5 right now, but that's largely due to poor time management due to Corps of Cadets activities, and because I never studied in my life. I took 16 hours last semester, and I'm taking 16 hours this semester. If I make a 4.0 this semester, I'll meet the 3.75 minimum for auto E-TAM.

But if my grades don't improve for whatever reason, is a 3.5 GPA good for E-TAM into CPEN? I got an A in ENGR 102, a"
Advice for CSCE 221,6,https://www.reddit.com/r/aggies/comments/192r1r8/advice_for_csce_221/,7,1704837776.0,"I am currently registered for CSCE 221 with Aravind Baravath. My impression of the class from other Reddit posts is that it is similar to CSCE 120/121 except the content will be a bit more difficult. Even though I was able to pulled an A in 121, I feel that I am still fundamentally lacking in a lot of the basic programming concepts (like linked lists). This insecurity, in addition to the lack of information about the instructor, has really crept up on me. Please give me some advice on what conce"
"Aggies...from another fellow aggie, I need your advice and encouragement",9,https://www.reddit.com/r/aggies/comments/18n4zzt/aggiesfrom_another_fellow_aggie_i_need_your/,6,1703105808.0,"This semester was a tough one for me. I had submitted my change of major application for ELEN on August 16th, and I was firmly set on doing all that I could to make sure my GPA and grades were as best as they could be in order to make myself stand out. But unfortunately, it didn't turn out like I hoped.

MATH 251 and CSCE 120 clapped me hard this semester. I got D's in both of them which tanked my GPA from a 3.3 to a 2.8, despite me going to office hours, watching YouTube videos, doing practice "
Letter grade and canvas grade not Matching up,2,https://www.reddit.com/r/aggies/comments/18n201m/letter_grade_and_canvas_grade_not_matching_up/,7,1703098084.0,So my professor just posted the grade of our final for CSCE-120 and I’m not sure why it’s a B when I calculated all my grades from the homework and the exams I’m wondering if there’s still something that isn’t graded that I need to see since based on what I currently have it should be an A.
Tips for Spring 2023,0,https://www.reddit.com/r/aggies/comments/18exbeb/tips_for_spring_2023/,12,1702189554.0,"I'll be a second semester freshman in spring. I currently have on my schedule math 251 and 304, university physics 206, csce 120, and engr 216. Will it be manageable to get all As in these classes? Does anyone have any tips for any of these classes?"
Calvin Beideman CSCE-120,3,https://www.reddit.com/r/aggies/comments/17v5fgj/calvin_beideman_csce120/,3,1699977832.0,"Hey y'all, 

Has anyone taken Calvin Beideman for CSCE-120? He appears to be relatively new starting just this fall. 

From what I've seen from his headshot, he looks pretty chill ngl."
Just confirming that this will be fine?,35,https://www.reddit.com/r/aggies/comments/173tazm/just_confirming_that_this_will_be_fine/,17,1696861933.0," 

Im a Gen Engineering student, hoping for Comp Sci. Im taking Chem 107/117 and Math 151 rn. Based on talking to upperclassmen, the advice is to accept credit for Math 152 and Phys 206 (which I have), take Calc III, and take an easy science instead of physics. The math part seems fine, but Im a little worried that if I accept Phys 206 credit, I will have to take a higher level science like Phys 207 or Phys 222. I have heard of people just taking some easy science like Geology or Atmospheric Sci"
CSCE 120 Community College,1,https://www.reddit.com/r/aggies/comments/15gi8jd/csce_120_community_college/,1,1691004446.0,"Howdy!

Does anyone know if there's any way to take CSCE 120 through community college? My advisor said it was possible but I don't see a tamu course transfer equivalency. Thanks and gig' em! 👍 "
Tips/Advice on Freshman year classes,5,https://www.reddit.com/r/aggies/comments/147t7l4/tipsadvice_on_freshman_year_classes/,5,1686592474.0,"My NSC is on June 22nd and I am currently planning on classes I want to take. This is what I have in mind: 

CHEM 107 + CHEM 117

ENGR 102

MATH 251

CSCE 181

CSCE 120

Could I get advice on any of these classes and any professor recommendations would be super helpful!"
CSCE 120 preparation,8,https://www.reddit.com/r/aggies/comments/13ulk75/csce_120_preparation/,22,1685337000.0,"Howdy, I plan to take CSCE 120 next semester with John Moore and I understand it is a difficult class. I have been studying C++ for a while now to prepare, but was also wondering if anyone knew where I could see any past syllabuses for the course, or if anyone still had a recent copy? That way I could try to take a look at what topics/work we'll cover and better prepare.

If we're not allowed to share syllabuses lmk so I can delete this, although idk why we wouldn't be allowed if it's shared to "
Preparing for CSCE 120 and CSCE 222,19,https://www.reddit.com/r/aggies/comments/13dtm4s/preparing_for_csce_120_and_csce_222/,8,1683731641.0,"Howdy,

I'm  a rising sophomore expecting to get into CPSC (auto-admit). I like to  get a head start on my classes when possible seeing as though the Corps  takes up about 30 hours of my time each week.

I've  done some browsing on the subreddit and internet and know that CSCE 120  is C++ programming, so I intend to become proficient in that over the  break. I know very little about CSCE 222 other than that it is a lot of  proofs.

What are some other things I can do to prepare for these classes"
CSCE 312/314 Over Summer,5,https://www.reddit.com/r/aggies/comments/1374k6y/csce_312314_over_summer/,11,1683160115.0,"I'm currently a freshman in engineering, I've taken CSCE 120, 181, 221, and 222. There is the Singapore trip in the winter break that looks really cool to me and a great way to get credit for CSCE 412 and 431, but they both require that I have taken CSCE 315.

Originally I had planned on just taking two community college core curriculum classes (talk about alliteration) this summer along with a part time job, but I've realized I can actually take 312 and 314 over the summer online. How hard are "
Why I hate general engineering advisors. Please help,15,https://www.reddit.com/r/aggies/comments/12tjp59/why_i_hate_general_engineering_advisors_please/,12,1682035024.0,"Hello Aggies subreddit

I am currently a freshman engineer filling out the engineering major application. I am on track to receive a 4.0 for the year however my case is special. I had AP credit for both Phys and Chem and took credit only after receiving written confirmation from the Engineering Advisors that it would not mess with my Auto Eligibility. The only condition to this was that I take CSCE 120 as I am pursuing Computer Science. Now my counselors are saying Auto Admit eligibility is revi"
ETAM Moment - Freshman Schedule,5,https://www.reddit.com/r/aggies/comments/12hrmak/etam_moment_freshman_schedule/,12,1681151670.0,"hi! i'm planning my fall-spring 2023 schedule right now as a freshman looking to ETAM into CS. getting a 3.75+ would definitely be ideal 😅 i have to take 2 chem, 2 math, and 2 engineering courses.

are there any easy CSCE courses i could take freshman year to satisfy degree requirements and still get an A?

should i use ap credit for MATH 151 and 152? i would still need to take two maths from MATH 251 or MATH 253, MATH 308, MATH 304, and CSCE 222. my main concern would be not getting the A 😓 and"
CSCE 120 - Honors or not?,0,https://www.reddit.com/r/aggies/comments/12dw7eg/csce_120_honors_or_not/,4,1680811514.0,Anyone here taken CSCE 120 honors with John Moore and have any opinions on it vs. just taking it regular w Chamon?
What class should I take earlier during sophomore year?,1,https://www.reddit.com/r/aggies/comments/11ufqrq/what_class_should_i_take_earlier_during_sophomore/,14,1679118356.0,"Howdy Ags,

My degree planner for sophomore year is looking something like this and wanted to know which class I should switch to Fall '23 to balance our credit hours.

Fall '23 (12 Credit Hours)

* CSCE 120
* ECEN 248
* ENGR 217
* MATH 251

Spring '24 (17 Credit Hours)

* CSCE 221
* CSCE 222
* ECEN 214
* ECEN 303
* MATH 308

I'm not too sure with which course switch would still accompany a good course and learning flow. Many of the courses have prerequisite conflicts as well, so maybe better to"
How many stem classes is too much?,4,https://www.reddit.com/r/aggies/comments/11sgd4n/how_many_stem_classes_is_too_much/,11,1678930875.0,"General consensus is that I should skip cal 2 and go to cal 3, so I’ll do that. After this semester, I’ll only need my major-specific communication elective, so I don’t want to jump to that just now (I etam in the fall). Instead I was given the option to take stat 211, math 304, or csce 120/222 (def not doing this rn).


I’m planning to take cal 3, physics 206 + lab, and I’m currently leaning towards stat 211 with that one professor. But asking the upperclassmen, is 3 (maybe 4 if you count the l"
CSCE 120,1,https://www.reddit.com/r/aggies/comments/zjhqb4/csce_120/,13,1670807749.0,"Howdy ags,

I’m sure this is asked a lot and I’m sorry to bog up the feed. I’m a freshman, and as a hopeful Computer Science major I’m taking CSCE 120 next semester (Spring 2023). I understand it’s a huge workload and I’m a little nervous about ETAM, so I’m wondering if anybody has any advice regarding what I can do over the break to prepare?

From my understanding it’s basically a C++ course, in that case are there any online courses or people you guys would recommend? Any tips for exams/assign"
csce 121 vs csce 120,1,https://www.reddit.com/r/aggies/comments/z8vj47/csce_121_vs_csce_120/,4,1669824936.0,"I am currently enrolled in 121 not 120. The program requirements show that I should take 120, but there are no seats left.

&#x200B;

[program requirements](https://preview.redd.it/0za4hxg3543a1.png?width=747&format=png&auto=webp&s=375328fc589d533f6dc692fad78e9d6147a1dfce)

However I *think* that it might be fine to take 121. Let me know what yall think.

Here is 120 vs 121

&#x200B;

[csce 120 and csce 121](https://preview.redd.it/hf2kyh65543a1.png?width=755&format=png&auto=webp&s=c31e2a35637e2"
Ran out of classes to take.,2,https://www.reddit.com/r/aggies/comments/z1g3tw/ran_out_of_classes_to_take/,11,1669079230.0,"Hello, I am currently a freshman planning my schedule for next semester. I am already registered for the required engineering courses like physics 206/216, cal 3, and instead of core classes im taking CSCE 120 and kine 199 to reach 12 hrs. The problem is that all my core credits are done and accounted for, so I only have 11 true hours going towards my degree, which affects financial aid. I am wondering which course I should take that would go towards my degree (CPEN planned, CSCE courses do coun"
Aspiring CSCE Major - Second Semester Course Load Achievable?,15,https://www.reddit.com/r/aggies/comments/z0x3lk/aspiring_csce_major_second_semester_course_load/,7,1669031545.0,"Hey y'all, I'm a Freshman going through ETAM right now and I'm trying to make the best use of my time to get a lot of classes out of the way early. I'd like to work on projects in my later years and potentially study abroad, so I'm taking CSCE 120, and 181 this semester and next semester I'll be taking more classes. I am registered for classes right now, with PHYS 216, PHYS 206, CSCE 221, CSCE 222, and MATH-304 (along with ENGR 181but that's just for a few weeks for honors) This is 15 hours of p"
Best CSCE Professor?,3,https://www.reddit.com/r/aggies/comments/ys1m2z/best_csce_professor/,3,1668142655.0,Howdy! I have recently decided to minor in computer science and the degree plan says that CSCE 120 or 121 class is required. What is the difference between the two and which professors do you recommend for either one? I am also taking Ochem II so I'm trying to find a good teacher who actually teaches and is an easy grader. Thank youuuu
Taking CSCE 120 over the summer?,2,https://www.reddit.com/r/aggies/comments/yb8sp1/taking_csce_120_over_the_summer/,3,1666501797.0,Has anyone taken CSCE 120 over the summer? Would you recommend it?
CSCE 120/121,13,https://www.reddit.com/r/aggies/comments/wg1qzy/csce_120121/,10,1659620957.0,Howdy! Im a rising freshman who finished my chem credit and my advisor is letting me drop chem for csce 120 or 121 but literally last night all the sections got full out of nowhere. My advisor told me to fill out a force request but the website says the time has passed to fill out force requests. Anyone else in this situation/any advice/comments/what might happen?
CSCE 121 is full,0,https://www.reddit.com/r/aggies/comments/u2ym05/csce_121_is_full/,18,1649879124.0,"I'm a freshman in engineering planning in going into comp sci. I need to take CSCE 121, but all of the sections are completely full. I heard it is getting phased out in favor of CSCE 120, but for some reason 121 is still on my degree plan. Is this correct? Do I need to submit a force request to get into the class or should I wait until ETAM results come out?"
ISEN schedule advice,0,https://www.reddit.com/r/aggies/comments/tvep3k/isen_schedule_advice/,8,1649007122.0,"Hello, I'm going into junior year in ISEN and I'm starting a CS minor. I'd like some insight on the feasibility of this schedule:

1. ISEN 230
2. ISEN 310
3. ISEN 320
4. MATH 308
5. CSCE 120/121"
CSCE 120,3,https://www.reddit.com/r/aggies/comments/qg6h61/csce_120/,7,1635255141.0,I'm a freshman in general engineering trying to get into computer engineering and previously you were supposed to take csce 121 but now it says csce 120. Has anybody taken this class this semester and what is it like? What professor would you recommend?
Couple of registration questions,0,https://www.reddit.com/r/aggies/comments/ozfx7b/couple_of_registration_questions/,5,1628285052.0,"1. I'm trying to register for my classes and a lot of them will have really low numbers, like one of the sections has ""Act: 3 Max: 0 Avl: -3."" Does this mean that more seats are going to be opened or is it saying that 3 people got forced in?
2. If I were to submit a force request, how late would be too late? I'd like to keep trying to get the profs I want rather than leaving it up to the department to pick, at least for a little while.
3. Can someone explain the difference between CSCE 120 and 1"
Do I have to talk to advisors regarding course substitutions not counting in the degree evaluations within the degree planner?,4,https://www.reddit.com/r/aggies/comments/ntenc1/do_i_have_to_talk_to_advisors_regarding_course/,3,1622957928.0,"I just got into my major for engineering so I’ve never had to care much for a degree plan until now. I have a few courses that count toward my degree but the degree evaluation doesn’t recognize them. For example, I recently took MATH 253 (Calc 3) at Blinn but since it’s not MATH 251, the Calc 3 course at TAMU, it isn’t recognized by the degree evaluation. They also recently changed CSCE 121 into CSCE 120 and since I’m taking CSCE 121 in the Fall, my degree plan doesn’t recognize it because it’s "
